author,created_utc,selftext,subreddit,title
MonkeyRides,1594945266,[removed],explainlikeimfive,Eli5: how does evolution know how mimic the eyes of a different as a scare tactic like it does on butterfly wings?
saravanakumar17,1594945260,[removed],explainlikeimfive,ELI5: What are some of the real time examples for abstraction and interface in java? How do I decide what to use?
Live-Love-Lie,1594945069,"A calorie is a unit of energy, if you burn X calories in a day and eat X+100 then you have 100 excess, if you eat X-100 you have burned 100. Without doing any more exercise how can a “fast metabolism” make you burn more calories, energy cannot be created or destroyed so the energy in the food you eat has to be converted into something, and if it’s not energy to move your body more then what is it being used for? People say they have a fast metabolism so they use the energy faster, but on what? Your body has to use it for an actual purpose it doesn’t just throw calories away into thin air...",explainlikeimfive,ELI5: how does a fast or slow metabolism affect how much calories you consume? Is a calorie not a calorie?
neja_,1594944812,[removed],explainlikeimfive,ELI5: How should we handle raw poultry/meat in the kitchen?
neja_,1594944718,[removed],explainlikeimfive,Is there a right way to handle raw poultry/meat in the kitchen?
ritamro,1594944622,,explainlikeimfive,ELI5: why do onions make us cry?
blorentz38,1594944583,[removed],explainlikeimfive,ELI5: How did February end up with 28 or 29 days while every other month has 30 to 31?
thedutchess-,1594944412,,explainlikeimfive,"ELI5 Why are juices like orange and apple so common, yet watermelon and strawberry juices are so hard to find?"
OdysseyZZZ,1594944297,,explainlikeimfive,Eli5: Autopsy. How is it done? Are things done on bodies no matter what or are procedures based on what a body looks like? What tools and techniques are used?
Cocokelt,1594944105,[removed],explainlikeimfive,ELI5:what's the point of a trifold mirror?
TheImageInTheMirror,1594944036,,explainlikeimfive,[eli5] Why do cheap quality or lower voltage chargers cause devices to heat up so much more than oem and higher voltage ones?
emmabananasplit,1594943862,[removed],explainlikeimfive,eli5: If America were to fail what would happen to the 1%? Would they move to different countries or would they feel the burden as well?
kdoggie96,1594943853,[removed],explainlikeimfive,"ELI5: Why do some people have dimples, while others don't?"
Worm01,1594943852,,explainlikeimfive,"eli5 Why is Gold inert, but silver and copper are reactive?"
Wolfblood-is-here,1594943691,"People might be taller or shorter than other people, but only to a certain extent, and in a way that retains the same basic shape; people of the same general size have small variations in the length of their fingers, or noses, etc. But it's fairly common for people to have penises half as long as average, or twice as long as average, and there's no way to tell by how big someone is otherwise. Why is this? It's not like you ever meet people with 'microthumbs', or foot long toes.",explainlikeimfive,ELI5: [NSFW] Why is penis size so variable when compared to any other part of the body?
bexmartino,1594943461,[removed],explainlikeimfive,Eli5: HOW DO YOU FRENCH INHALE ?!?
sifterandrake,1594943375,[removed],explainlikeimfive,ELI5: Why does my ear hurt when I hold a latex balloon near it?
EmuSparkleHusband,1594943155,[removed],explainlikeimfive,"ELi5 Why do things such as sand, hair, and paper look darker when wet?"
sifterandrake,1594943088,[removed],explainlikeimfive,EIL5: why does my ear hurt when I hold a latex balloon near it?
EmuSparkleHusband,1594943077,[removed],explainlikeimfive,"Please ELI5, why do things look darker when wet?"
DomMedbery11,1594942673,,explainlikeimfive,ELI5 Why do air bubbles take the shape of a sphere when under water?
Hedonistic_Epicurean,1594942102,"Pouring stuff down the sink like lye and other various chemicals, how do water treatment plants dilute such strong chemicals to make water potable again?",explainlikeimfive,ELI5: How do water treatment plants treat potentially fatal chemicals being poured down the sink?
Jimmiemcd,1594942080,[removed],explainlikeimfive,ELI5 How are colors picked when colorizing old photos?
weirdichi,1594942013,[removed],explainlikeimfive,ELI5: Why have there been no charges for Trump employees endorsing products?
civantrilece,1594941919,[removed],explainlikeimfive,ELI5: Why glutamate which is an neurotransmitter has neurotoxic property when it is excessive?
KhaoticArts,1594941822,[removed],explainlikeimfive,How are feminists not hypocritical when they want equality and then say things along the lines of “All men are trash?”
Benbrains,1594941629,,explainlikeimfive,"ELI5: If we lose multiple hairs naturally every day, how do we not eventually lose all our longer hairs and only the new ones that grow in remain?"
Bridgeburner_Fiddler,1594941480,,explainlikeimfive,ELI5: What power do state employees unions have if it is illegal for them to strike?
BigBadBeluga,1594941416,I was doing my partner’s laundry earlier today and I saw on a lot of her clothes that there is a clear plastic strap on the shoulder I had never really noticed before. What is its purpose and why is this seemingly on every garment?,explainlikeimfive,ELI5: What is the purpose on the plastic strap on women’s clothing?
Fer_nandoaya,1594941369,,explainlikeimfive,"Eli5: I live in a extremely hot area (115 degrees F) I understand that the pipes run underground and the dirt insulated it to keep it cooler, but, the water coming out of my sink will get as low at 65-70 degrees, which seems cooler than should be possible just by insulation from the ground."
Jos3HD,1594941324,Why they decay so often? It's not supposed that they are stable because they are not radioactive?,explainlikeimfive,Eli5: Why most of sintetic elements are unstable?
AlvinTaco,1594941230,"Full disclosure, I’m trying to find a good way to explain this to a nine year old, so if you can really ELI5 it would be much appreciated. They know what series and parallel circuits are, and how they work, but not *why* they work that way. Basically they (and I) want to know, how does electricity know the difference?",explainlikeimfive,"ELI5: Why does a current spread out its voltage between every additional load in a series circuit, but not with additional pathways in a parallel circuit?"
Fer_nandoaya,1594941144,[removed],explainlikeimfive,"I live in a extremely hot area (115 degrees F) I understand that the pipes run underground and the dirt insulated it to keep it cooler, but, the water coming out of my sink will get as low at 65-70 degrees, which seems cooler than should be possible just by insulation from the ground. Eli5"
astayer21,1594940745,,explainlikeimfive,ELI5: What is MSG? Why does it make everything taste delicious? And why is there such a bad stigma around it?
SimonCaine,1594940739,[removed],explainlikeimfive,Eli5: why is it so hard to offer universal basic income in the UK?
Israelicheese,1594940654,,explainlikeimfive,ELI5: Why are Muslims fighting and killing each other?
Janko_Hrasko1,1594940449,,explainlikeimfive,"Eli5: Why it's common to have two (or more) graphic cards in computer, but there is always only one processor? Wouldn't it help to have two of them?"
pEot_ABC,1594940355,[removed],explainlikeimfive,eli5: New-Baby-Smell
indocartel,1594940051,"I remember learning in my MBA that companies control other companies voting rights by having many shell company's at once, kind of like the big fish eating smaller fishes. I'm going blank but something like the company owns 50% of the shell that owns 25% of the actual company and therefore has majority votes. Can someone ELI5 or provide a name or more info. on this. Thanks.",explainlikeimfive,ELI5 Voting rights (majority) through multiple shell company's
LoneShark81,1594939779,,explainlikeimfive,ELI5: Why cant the immune system fight off certain bacterial infections? Strep throat? Chlamydia? etc?
BEllinWoo,1594939534,"I have been seeing it more and more on FB and other social media. Mainly from my crazy aunts...that we are going cashless and it would be the ""ultimate end to her freedom"".  What's the deal here?",explainlikeimfive,ELI5: Why are many people so concerned about becoming a cashless society? Would it be that bad? And is it likely to come to fruition?
TheWhiteEvil502,1594939505,,explainlikeimfive,ELI5: Why do we gasp when startled
RedQviks,1594939292,[removed],explainlikeimfive,"ELI5: Why can I eat after brushing my teeth in the morning, but I can't eat at night?"
skafy,1594939166,,explainlikeimfive,"eli5: Modern cars have parking assistance where it looks like a drone flies over it. It even works indoor. It even shows the surrounding in real, not just in outlines How does this work?"
gabzlel,1594938881,,explainlikeimfive,ELI5: How come our faces appear more asymmetrical when taking a photo but not when looking at someone else in person?
rach51918,1594938866,"I’ve tried looking this up but all I see is “the commutator reverses the current” it doesnt explain in simple terms how it does it. They’re just two pieces of semi-circle metal, how does it reverse the current?",explainlikeimfive,ELI5: How does a commutator reverse flow of current in a motor?
TheStinkyBoi,1594938818,,explainlikeimfive,Eli5: how does a lava lamp work?
rach51918,1594938807,"I’ve tried looking this up but all I see is “the commutator reverses the current” it doesnt explain in simple terms how it does it. They’re just two pieces of semi-circle metal, how does it reverse the current?",explainlikeimfive,ELI5: how does a commutatircommutator reverse the flow of current in a motor?
pewlat,1594938800,[removed],explainlikeimfive,Eli5 Metric system
zulu9812,1594938416,Question's in the title really. Unless I'm the only one this happens to. Why do we get a headache if we sleep for too long?,explainlikeimfive,ELI5: Why do we get a headache if we sleep too much?
dexmerty,1594938343,[removed],explainlikeimfive,"ELI5 : If we managed to go to the moon with 1969's technology, why don't we go there again? Did we discover everything on the moon?"
LoneShark81,1594938242,[removed],explainlikeimfive,ELI5:Why cant the immune system fight off certain bacterial infections? Strep throat? Chlamydia? etc?
sploosh123456,1594937762,Can’t wrap my head around why people have this reaction to things like the cold or being touched.,explainlikeimfive,ELI5: Why do nipples get hard?
GingkathFox,1594937407,[removed],explainlikeimfive,"ELI5: Why do some people have ""weak"" stomachs?"
Swolnerman,1594937388,[removed],explainlikeimfive,"eli5: What does “mining bitcoin” mean, and why is there possibly free money to gain from it?"
ihateu1913,1594937276,What’s there end game? World domination? Is it less evil than that?,explainlikeimfive,Eli5 Russia's interferences with foreign elections.
jmathews777,1594937179,"This concept has always baffled me.
Any help would be greatly appreciated!",explainlikeimfive,ELI5: Why can we never tell the exact moment we fall asleep?
fatfaye,1594937170,[removed],explainlikeimfive,Why when white people do stuff the white population is not expect to do a mass condemnation as the minorities are for people of their race/religion? eli5
WoahTheBear,1594937040,[removed],explainlikeimfive,ELI5:Why is America divided with mask?
lilman4003,1594936978,[removed],explainlikeimfive,"ELI5: Today's high will be 97, but it will feel like 107."
AquaBoy336,1594936837,[removed],explainlikeimfive,ELI5: Why is there an illuminati symbol on american dollar bills ? ( the pyramide and the eye )
Dee-Wills,1594936755,,explainlikeimfive,ELI5: Why are mattress handles never where they need to be? Why are they on the sides and not top and bottom for easy carrying? What purpose do they serve on the sides?
reveek,1594936516,Just what the title says: why does applying pressure to certain parts of your head reduce the pain from a headache (temporarily)?,explainlikeimfive,ELI5: why does pressure on the outside of your head relieve headaches?
globustr,1594936506,[removed],explainlikeimfive,The Sun
Shellie7297,1594936067,"I started having panic attacks 5 years ago. Since then, my brain is often in a fog  and I’ve noticed a decline in memory ability. Why is that?",explainlikeimfive,ELI5 Why does anxiety cause brain fog and memory issues?
The1Ski,1594935770,[removed],explainlikeimfive,"ELI5: Why does my dog eat the cat's poop, but not her own?"
bwmlax,1594935315,"I'm interested in pharmaceuticals and chemistry and am wondering how salts are different from the normal form of something.

I cannot remember what it was, but a certain substance was completely innocuous but in its salt form was extremely toxic.",explainlikeimfive,ELI5 : What is are salts and how do they differ from the regular compound/substance?
Ascouric,1594935267,[removed],explainlikeimfive,"ELI5: When I turn on a light, where does all the dark go?"
MassGootz,1594935084,,explainlikeimfive,ELI5: What causes that delay on cellphone that you hear sometimes where you hear your own voice back a second or 2 later and how can that happen if your voice isn't being recorded and played back?
randomredditing,1594934790,"I think this is physics based(?), but I thought of this question during my summer chemistry course, so I wasn’t sure of the flair.",explainlikeimfive,"ELI5: The first law of thermodynamics states that the energy of the universe is constant, but the universe is constantly expanding, so how does the energy stay constant considering the expansion?"
Poltergust5k,1594934761,,explainlikeimfive,"ELI5. We're taught about how everything is made of atoms that have varying density and movement patterns, but I have a hard time wrapping my head around everything being made of tiny Dippin' Dots. How exactly does it work and what is in the space between them?"
guitarsngasmasks,1594934675,,explainlikeimfive,ELI5: What was the Rhodesian Bush War?
saka47,1594934632,,explainlikeimfive,ELI5: Scratched my knee and felt the sensation on my lower back
ReptilianViking,1594934554,"I realised this after trying to change clothes in the dark, and noticed that my balance was fine in the dark room, but when I had tried with my eyes closed, it was far more difficult.",explainlikeimfive,"ELI5: Why is it difficult to balance on one foot with your eyes closed, but not as difficult (or at all difficult) to balance in a pitch black room with your eyes open?"
slovenlyshebear,1594934392,What is an n number? What is a mode S code? Is it possible to find information that is not listed on the FAA registry?,explainlikeimfive,ELI5: FAA aircraft registration in the US?
Bengeva,1594934391,[removed],explainlikeimfive,ELI5 Paradox
BjornReborn,1594934310,"I was thinking about this and I would like to see if any agriculture people know the answer. 

Why are we able to ultimately plant individual pots and small plants on the window sill (and they can grow), but the idea of attempting a garden indoors to set up an area that isn't disturbed by wildlife seems impossible? 

I thought it could've been that the sunlight isn't enough for a small garden vs an individual plant pot, but i'm not sure that that makes much sense. 

If we can figure out how to essentially have indoor gardens.. we wouldn't need to use pesticides to keep animals off our fruits and veggies and we could grow crops year round that before were impossible to grow year round. 

I just looked up on Google about indoor gardens and those are usually refering to flowers not plants. When it is about plants, they say to only have them indoors for a short amount of time before taking them and replanting them outside.",explainlikeimfive,"ELI5: Why can't we take outdoor soil, move it indoors and set up a gardening system that still gets direct sunlight and see the same results as an outdoor garden?"
aronijuragana,1594934273,[removed],explainlikeimfive,"ELI5 Why does USA use AM and PM instead of 24h time, like the rest of the world (or at least Europe)?"
saka47,1594934186,[removed],explainlikeimfive,ELI5: I be itching at my knee from a mosquito bite then I felt it on my lower back.
chosenstars,1594933280,"Before I write everything here I want to say that I don’t have anything against marijuana I’m just curious, because I had a friend a couple years ago who said things to me that signaled he was very ill and I loved him to death still but he would say he thought God was speaking to him, a demon called Jezebel was after him, he was preparing for the end of times, etc. I did ask him if he thought it was anything... else but he just paused for a really long time and said, “Don’t tell me you think it’s ghosts!”

Incidentally, when we first met he was scared of me because I‘m Asian and he said he had a nightmare about the grudge and distrusted (East) Asians ever since (from what I remember).

I asked him when this stuff starting happening and he said smoking marijuana brought about his awakening of sorts. I thought it weird because I don’t see how that would occur considering it just makes you feel calm and hungry, right? 

I don’t know if he just said that and took some other drug, but that’s what I remember and that leads me to the question that could weed bring out symptoms of someone whose disorder was “under the wraps”? Should mention that I don’t have contact with him anymore, for different reasons.",explainlikeimfive,ELI5: Can marijuana ‘bring out’ psychiatric symptoms of someone predisposed to a certain disorder?
Immola0069,1594933153,,explainlikeimfive,ELI5: What causes the cringe after drinking a shot of hard alcohol? How come a chase drink seems to alleviate some of it?
fdghjik,1594932996,"Like when you brace yourself to sit on a toilet seat because you expect that moment of shock from the cold you feel on contact, even though that seat is the same temperature as the room temperature environment of the bathroom. Or the fact that leaning your face against a wall feels cooler than air of the same temperature that is already touching your face.",explainlikeimfive,"ELI5: Why is it that room temperature air doesn't feel noticeably cold to our skin, but if I touch a computer/toilet seat/wooden wall that has also been sitting at room temperature, it feels cold to the touch?"
CaptainDreadEye,1594932809,I'm trying to understand [this clip](https://www.youtube.com/watch?v=sK8RGKnkYks) but don't and I need some context.,explainlikeimfive,ELI5: How does short selling work?
EricHasSomethingToSa,1594932665,[removed],explainlikeimfive,ELI5 : How are presidential candidates chosen?
slovenlyshebear,1594932657,[removed],explainlikeimfive,ELI5: aircraft registration with the FAA in the US.
obsessive1,1594932572,"Generally if you drink lots of extra water, you'll need to visit the toilet more often. But that isn't the case after a very salty meal. Where is the water going?",explainlikeimfive,"ELI5: When you have a salty meal, you need to drink more water. Where does the water go?"
trilliondollarbaby1,1594932420,[removed],explainlikeimfive,AFHH RULE - eli5
walids,1594932279,,explainlikeimfive,ELI5: ELI5:how do you calculate how many possible chess moves can be made at any given point in the game?
arguingonlineisdumb,1594931766,,explainlikeimfive,ELI5: Why are infantry the only force able to hold ground?
tpsince93,1594931721,,explainlikeimfive,"ELI5 chemical analysis terms- LOD, LLOQ, and ACTION"
tpsince93,1594931635,[removed],explainlikeimfive,"What do LLOQ, LOD, and ACTION mean? (Chemical analysis)"
aestheticdickwad,1594931535,,explainlikeimfive,eli5: If the air is moist in winter and dry in summer then why does skin get dry in winter?
aestheticdickwad,1594931485,[removed],explainlikeimfive,eli5: If the air is moist in winter and dry in summer then why does my skin get dry in winter?
11diddles,1594931414,[removed],explainlikeimfive,eli5: Celcius is lower than farenheit or the other way round?
Mchoa696,1594931206,,explainlikeimfive,Eli5: What makes the view from a high place enjoyable?
ReptilianViking,1594931206,"I know weeds with flowers spread with pollen and have seeds that can get carried by the wind like dandelions and stuff, but how do other weeds spread so much?",explainlikeimfive,"ELI5: How do weeds that don't have flowers, spread to really far distances within (or outside) a country?"
walids,1594931015,[removed],explainlikeimfive,ELI5:how do you calculate how many possible chess moves can be made at any given point in the game?
Lunny1767,1594930986,"For example, a car or any other device with wheels moves. What I never fully understood is how the heck are they moving giant masses of sorts by that electrical and chemical process, and how rubber withstands that much metal on top of it.",explainlikeimfive,ELI5: How do 1's and 0's and electricity tell chemical elements to move?
rustyderps,1594930575,[removed],explainlikeimfive,ELI5 how does Facebook know I play hearthstone?
Littlefuty,1594930323,,explainlikeimfive,ELI5: Why do we exist
RemyMart23,1594930249,[removed],explainlikeimfive,eli5 Why cant i sleep well if i have an exciting plan the next day?
jungkooktaeharu,1594930173,[removed],explainlikeimfive,ELI5: Why is bird poop black and white?
TemperateHandLuke,1594930120,,explainlikeimfive,ELI5: Why does playing dead work?
walids,1594930117,[removed],explainlikeimfive,ELI5:can we travel back in time?(from a logical perspective)
AnAbnormalGuy,1594930080,"As the title says, I would reckon it wouldnt because the mirror is cold, but I'm unsure of the how and what",explainlikeimfive,"ELI5: If you use thermal/heat detecting devices in a mirror, would you detect the heat? Why or why not?"
AMRunner,1594929870,,explainlikeimfive,ELI5: How does one ‘slip a disc’ in their back?
surfsoundcollection,1594929627,,explainlikeimfive,ELI5: The War on Drugs
abqbqoruebendeu7nkg,1594929574,FYI I don't really know a lot about pregnancies in general,explainlikeimfive,"ELI5: if a woman has twins, in the womb does she have 2 umbilical cords and 1 placenta or.....what?"
CodeinLYchee1299,1594929429,"When somebody is executed, multiple substances are injected successively. The syringe has to be cleaned in between to avoid the execution failing and even if everything is done correctly, it may take some time for the person to die which can lead to a very painful death. The thing is, we know a lot of substances that kill really quickly and only require one injection, so why aren't these used to execute criminals?",explainlikeimfive,ELI5: Why is executing someone via injection so complicated?
seasonedgirl,1594929185,,explainlikeimfive,ELI5 Why do we go through stages of grief instead of just accepting it?
Clone3,1594928884,[removed],explainlikeimfive,EML5: How can the Trump administration take control of the Covid data?
Lahoski64,1594928869,"We've all heard about ""healing crystals"". I've always thought of it as rubbish. But then I found out about quartz clocks, which use a quartz crystal to keep ""the track of time"" with their constant vibration.  
How do watches use the quartz's vibration and if everything in the universe always vibrates, how do crystals not affect us? If quartz crystal can ""keep a watch in time"" is it really possible that crystals could affect humans in some ways?",explainlikeimfive,"ELI5 Quartz watches and ""healing"" crystals - How does it all work?"
jade_1989al,1594928705,I’m just curious I’ve seen videos like cooking videos with like siblings that have Tourettes and Although I understand the ticks I was literally just curious where the swears come in to play?,explainlikeimfive,eli5 Are people with Tourette’s born knowing swears?
HighFiveMePlease,1594928426,,explainlikeimfive,ELI5 Why are our bodies more sensitive to temperature changes while sleeping than awake?
howdoyousayyatch,1594928170,,explainlikeimfive,ELI5: Why is it that our finger nails grow faster than our toenails?
Trwtrg,1594928052,Why does diet soda give a more violent reaction than regular when you drop a Mentos in?,explainlikeimfive,Eli5 Diet Soda + Mentos
AnxiousCheezit,1594927886,,explainlikeimfive,"ELI5: what exactly a factory unlocked iPhone is, and what you can do with it"
THE_BANANA_KING_14,1594927461,,explainlikeimfive,ELI5 What is the origin/reasoning behind the 5 point star-like shape on the bottom of plastic soda bottles? Wouldn't a flat design be more stable?
gautambitious,1594926658,"I've read the definitions a lot of times but I just want to understand what they really mean. I think of median as 50 percentile, but I'm not sure if that's correct or not.",explainlikeimfive,"ELI5: What is mean, mode and median from a practical perspective?"
willba4ce,1594926491,"Is it a noise they are intentionally making themselves, or is it just byproduct of their flight/wing movement?",explainlikeimfive,ELI5: Why do insects make a 'buzz' noise when they fly?
Thisshouldnttake2hrs,1594926458,[removed],explainlikeimfive,ELI5: What is capitalism?
JashBhanushali,1594926453,"Electromagnetic waves of certain wavelengths can cause cancer but now they plan on implanting diodes all over the brain to read brain activity so we can interface with devices directly? 

Is it fine to do so or is it something that kinda poses a risk but we're not sure about the effects yet?",explainlikeimfive,"ELI5: As kids, our elders always told us that screens would ruin our eyes. Yet we use VRs that hold up screens right in front of our eyes?"
Jmcduff5,1594926408,[removed],explainlikeimfive,ELI5: How does HHS directing hospitals and other medical facilities to stop reporting Covid 19 data to the CDC effect the accuracy and integrity of the information access by the pubic on the spread of the disease?
tomfoolery77,1594926211,,explainlikeimfive,ELI5 Why does Lake Michigan (all lakes?) look so light blue and tropical after a storm?
