author,created_utc,selftext,subreddit,title
tsundoku23,1594728479,"If someone possibly had, for example, an inner ear infection but also UTI or a kidney infection would one batch of antibiotics solve both problems or would they need specific antibiotics for each specific body part?",explainlikeimfive,ELi5: Are antibiotics targeted to specific parts of the body?
idontstfu,1594728035,[removed],explainlikeimfive,"ELI5: How do some people only sleep 4 hours a day and function ""normally"" and while others NEED 7 hours or naps just to feel rested?"
Usernam_fara_e,1594727434,[removed],explainlikeimfive,ELI5 Why the voice in my head seems more accurate than my speaking.
cookblook,1594727241,[removed],explainlikeimfive,ELI5: What causes the “wet dog” smell? And why do all dogs smell the same when wet?
Irishbhoy1967,1594727092,[removed],explainlikeimfive,eli5 Covoid death numbers
xryanpagex,1594727047,[removed],explainlikeimfive,ELI5: How does wireless charging work?
Irishbhoy1967,1594726957,[removed],explainlikeimfive,eli5 US death rate in April v July
buoninachos,1594726907,,explainlikeimfive,ELI5: Why do you usually have to hold down the gas button for a few seconds when lighting a stove or gas oven to keep it lit after you release the button?
SealieKai,1594726420,,explainlikeimfive,ELI5: How do roulette dealers keep track of which bets are whose to prevent players from stealing winning chips?
kummerbrummer,1594726285,[removed],explainlikeimfive,ELI5: I am right-handed. Yesterday I found out that my left hand is way stronger than my right one. Is there any biological reason for that?
crossang,1594725883,,explainlikeimfive,"ELI5: If Amazon and similar corporates haven't turned profitable, then how are they paying their shareholders/investors?"
[deleted],1594725844,[deleted],explainlikeimfive,"ELI5: If Amazon and similar corporates haven't turned profitable, then how are they paying their shareholders?"
Aqeel01,1594725508,[removed],explainlikeimfive,ELI5 What exactly is a computer?
ren_dar,1594725421,[removed],explainlikeimfive,ELI5: The Youtube Algorithm
[deleted],1594724418,,explainlikeimfive,ELI5: Why don't you take the same medication as a general anesthetic surgery for execution in prison?
seedingson,1594724196,"I just can't fathom what's on the other side of the universe, and would love if you guys could help!",explainlikeimfive,"ELI5: If the universe is always expanding, that means that there are places that the universe hasn't reached yet. What is there before the universe gets there."
Bored_fellas,1594723266,,explainlikeimfive,ELI5: How come we can remember a part of a memory but not the whole thing
doflamingo13,1594723202,,explainlikeimfive,ELI5: why cold canned/bottled drink taste better than cold drink in carton or plastic bottle?
VanillaSnake21,1594723163,https://www.reddit.com/r/nextfuckinglevel/comments/hqwjap/underwater_rings_are_sure_cool_thing/?utm_medium=android_app&amp;utm_source=share,explainlikeimfive,ELI5: Why do the bubble rings attract each other in this video?
thierizard,1594722732,[removed],explainlikeimfive,ELI5 whats the difference between zebra's and horses?
Kingjjc267,1594722525,[removed],explainlikeimfive,ELI5: What are the differences between introversion and social anxiety?
Northpaw27,1594722443,,explainlikeimfive,ELI5: Why do we get sand on beaches but not soil?
[deleted],1594722439,,explainlikeimfive,"ELI5: I always get confused between introversion and social anxiety. What are simple definitions of both so I can tell them apart, and figure out which one (or both) I have?"
gaussianCopulator,1594722400,[removed],explainlikeimfive,ELI5: What is the biological mechanism behind post-nut clarity?
Isaiah_6_8,1594722311,"ELI5: what causes ""double vision"" when I'm intoxicated.   And why does it help when I shut (wink) an eye",explainlikeimfive,"ELI5: what causes ""double vision"" when I'm intoxicated"
Nicko265,1594722258,"Stuff like [this](https://www.woolworths.com.au/shop/productdetails/825620/woolworths-chicken-pad-thai-with-rice-noodles). It's kept at room temperature but has cooked chicken in it, whereas generally you're advised to refrigerator cooked poultry within 2 hours for it to be safe. This has been kept at room temperature for months and can last in the cupboard for nearly a year.

Is it just because it's sealed and kept free of mold spores and bacteria after being cooked?",explainlikeimfive,ELI5: How are ready-made boxes meals kept safe in the supermarket?
ipul00,1594721374,,explainlikeimfive,"ELI5: Why is the sound of coins dropping on the floor so recognizable, even in a noisy setting?"
Tibor500,1594721370,"so, i’m planning on getting the Macbook Air and i don’t know if i want 8 GB memory or 16 GB, basically what does memory mean? will the computer be stronger with 16 GB?",explainlikeimfive,eli5: what does the memory mean in a Macbook?
Poptart_13,1594720371,[removed],explainlikeimfive,ELI5: Why is there wax on candles?
Powman68,1594719942,"Pretty much what it says in the title. How do organ transplants know to heal with donor tissue. Also when the body rejects a donor, is that due to genetic differences?",explainlikeimfive,ELI5 How do organ transplants heal?
blindman96,1594719927,[removed],explainlikeimfive,ELI5: How does time dilation speed up or slow down time or ageing?
FortifiedSky,1594719447,,explainlikeimfive,"ELI5: How do lights in digital radios / alarm clocks / keyboards / etc, stay on for years and years without ever burning out?"
[deleted],1594719337,[deleted],explainlikeimfive,ELI5: How can I buy and sell stocks?
[deleted],1594718875,[deleted],explainlikeimfive,ELI5: What happens to the water when you chocke
[deleted],1594718705,,explainlikeimfive,"If Amazon and similar corporates haven't turned profitable, then how are they paying their shareholders?"
bluediavolo,1594718596,[removed],explainlikeimfive,ELI5: Why does the world need advertising?
raziuuu,1594718392,,explainlikeimfive,ELI5: Why do dug up skeletons don't have their clothes on?
michacu,1594717333,"Also, what is the point of their existence then? How do they contribute to the environment?",explainlikeimfive,ELI5: Where do certain insects get their energy from if they don't eat and their sole purpose is just to reproduce and die?
gaussianCopulator,1594717307,[removed],explainlikeimfive,What is the biological mechanism behind post-nut clarity?
gnarly_carvaholic,1594717022,,explainlikeimfive,ELI5: Why are kettles so loud when they start up and become quieter as the water starts boiling?
real_smoky,1594716982,[removed],explainlikeimfive,Eli5: What is an recommended serving size/portion based on? How many portions of different foods should one eat per day/week?
SinghJM,1594716930,[removed],explainlikeimfive,"Eli5: What's the difference between endemic, pandemic, break-out, spread and epidemic."
RicardoMilossGoa,1594716761,,explainlikeimfive,ELI5: Why hasn't the sun vaporized Mecury yet?
WuschelBlep,1594716575,"So, me and my best friend have very different body types. We both were a bit chubby as kids, and have grown out of it. About 2 years ago we were aprox. the same height and weight. Now she's super skinny and I'm still chubby. We do work out together, do the same exercises, eat mostly the same (We mealprep together) and we have the same job that requires the same level of movement.

&amp;#x200B;

How come she's super skinny and I'm chubby? I know its got something to do with metabolism, but how does that work exactly? How come one metabolism is faster than the other?",explainlikeimfive,ELI5: How does metabolism work?
CastleMaddox,1594716487,[removed],explainlikeimfive,ELI5: What is the difference of cost if the US created universal healthcare and dissolved medical insurance companies for the average American?
Zapbroob,1594716140,,explainlikeimfive,ELI5: Why can't adults learn languages like children?
Tehcardsmen,1594716084,,explainlikeimfive,"ELI5: If the United States goes into an economic depression, how would it affect the rest of the world?"
lifeshortlivewell,1594715923,"I made meal prep foods, and it consisted of almost all of those things, and now I'm devastated and devastated",explainlikeimfive,"ELI5: how is it all of the sudden it's ""toxic"" to reheat chicken, eggs, spinach, rice, and mushrooms??"
Loner_Sheep_14,1594715914,,explainlikeimfive,"ELI5: What's the difference of having food intolerance, and having upset stomach because you're not used to what your eating as of the moment?"
RizziChhips,1594715716,"A typical outlet where i live carries 15-20 amps, more than enough to kill someone. when i was younger i decided to touch an outlet that had prongs sticking out of it. I touched both prongs with one finger. I assume i didn't die because electricity takes the path of least resistance, and only traveled through my finger and didnt interfere with my heart. Dont know if i am correct but if i am, how many amps would have killed me in that instance?",explainlikeimfive,"Eli5: How many amps does it take to kill a human, if the current does not cross your heart?"
Gdawwgg,1594715207,,explainlikeimfive,"eli5 Why is dark humour funny? Does liking dark humour make me racist, misogynistic or sexist?"
Username_Sniper,1594715100,,explainlikeimfive,ELI5: Why do humans have ulcers in the mouth?
SinghJM,1594714554,Title explains the intent of question about linguistics.,explainlikeimfive,eli5: Difference between etymology and Derivation?
gebruikernaam,1594714368,[removed],explainlikeimfive,ELI5: Two of the interventions Dr Fauci mentioned could help fight COVID19 (besides remdesivir and dexamethasone): (heart?) immunoglobulin and monoclonal antibodies. Link below (at 8 minutes in).
qrsyua,1594713485,,explainlikeimfive,"ELI5: Why do oscillating fans sometimes get louder, less frequently than their cycle?"
ae_rhh,1594713240,What is Prosopagnosia and can you provide simple explanation on how it works? Or what prosopagnosics see?,explainlikeimfive,ELI5: What is Prosopagnosia?
EyeOfLogician,1594713171,"I was trying to understand the shape of space time, and I came active this term. I googled, but there's nothing I can wrap my head around. 
Please help.",explainlikeimfive,Eli5: what is an Einstein tensor?
ae_rhh,1594713060,[removed],explainlikeimfive,What is prosopagnosia and how does it work?
DeathAngel11,1594712790,"We sleep with blankets on, and have heated homes. However there is a fine line between a relaxing amount of heat and too much heat. Why is it that basking in the sun is enjoyable, but a cold winter day is not?",explainlikeimfive,Eli5: How does heat affect the body?
DeathAngel11,1594712527,"Many animals have ears or some way of hearing, But how exactly does the sound travel into the ear and process into what we hear?",explainlikeimfive,Eli5: How do ears work?
imphetamine,1594712426,[removed],explainlikeimfive,ELI5: Can somebody explain the political spectrum to me?
UnemployedGraduate_,1594712399,[removed],explainlikeimfive,ELI5: How are surgical masks protective against viruses if you can still smell strong scents whilst wearing one?
DrRant,1594712203,I've always just clicked the box to use newest directx and now I saw a new API named Vulkan enter the market. What these software actually do with gpu to make flashy things in your monitor?,explainlikeimfive,"ELI5: what API does, and how it does it?"
S-THE-GR8,1594711364,My sister always does it and I’m confused.,explainlikeimfive,ELI5: Why do we tend to scratch our head when we are trying to solve something?
VexApollodorus,1594711220,,explainlikeimfive,ELI5: What is the difference between KPI and CTQ? Are they related?
catlasagna,1594711058,I'n not sure if this goes for any type of car but for mine it seems like objects in the rear mirror appear a lot closer than they actually are.,explainlikeimfive,ELI5: Why do cars appear so much closer in the rear mirror than in the wing mirror?
yeronyms,1594710996,,explainlikeimfive,ELI5: how is possible that with more age you have bigger hangover?
error-10,1594710905,,explainlikeimfive,ELI5: why do people with down syndrome look the same?
error-10,1594710905,,explainlikeimfive,ELI5: why do people with down syndrome look the same?
vignesh-2002,1594710626,"I am a beginner for image processing

I know python language

Don't suggest me to import some module and call some function to process image

I want to study from the base

I made a series on image processing on Instagram without any modules and functions

[Insta page](https://www.instagram.com/_._hello_world._._/)

It's not a promotion,  you can judge my level on image processing to give me better recommendation of courses

If you want to see my insta page,  i made 11 parts , as they are interlinked, start from part-0

Please don't skip this post thinking it's a promotion
I really want to study image processing
Suggest me some good  course",explainlikeimfive,Eli5: what are the best image processing resourses?
Lasersmatter,1594709546,[removed],explainlikeimfive,"Eli5: Why does the roof of my mouth sometimes itch like crazy, but the rest of my mouth is fine?"
badchoicesalways,1594708853,[removed],explainlikeimfive,"ELI5: What makes people talk in their sleep, and why do only some do it?"
DefinitelyNotASkrull,1594708735,[removed],explainlikeimfive,ELI5: How do Congresspeople get paid?
sammin4932,1594708666,,explainlikeimfive,"ELI5: Why is seawater bad for your body, but salt water is recommended during the summer?"
doltishRedditor,1594708281,[removed],explainlikeimfive,ELI5: The line I crossed by asking how I can help alleviate problems that face women with gifted bosoms
soulfighter98,1594707677,,explainlikeimfive,Eli5 :Do Plants feel Emotions?
hobrien123,1594707639,,explainlikeimfive,ELI5: Is there a biological/physical limit to the amount of knowledge we can store in our brains?
jumavegi,1594707537,,explainlikeimfive,ELI5 why do muscles go numb while sleeping?
TheArtisticTurle,1594707076,,explainlikeimfive,eli5: Could Iron Lungs be brought of retirement since we're facing a shortage of ventilators? Would they be just as effective?
--DJDISDABEST--,1594706628,do they just trace the route to the ip address and see the ip of the nearest data center or isp and know its in they area?,explainlikeimfive,ELI5: how ip addresses can find real world locations?
mankieblanx,1594706561,"Surely a fan would have taken it before them, especially if the celebrity in question joined after they became well known. 

Take Billie Eilish for example, her username on Instagram was wherearetheavocados for the longest time, even after she got millions of followers. How was she able to switch her username to her actual name without difficulty? I know that as soon as she changed it someone stole wherearetheavocados almost immediately. How do they not get their names used as usernames??",explainlikeimfive,ELI5: How are celebrities always able to put their actual name as their username on social media platforms without someone already taking it?
bcl15005,1594706488,"What caused world war 1 shell shock'? I'm aware that PTSD and stress reaction injuries are still common in modern warfare, but I'm curious what caused the specific convulsing/shaking phenomena seen in soldiers exposed to heavy shelling in ww1? Were the causes due to physical brain damage from concussion, or was it a psychological reaction? You don't seem to see people coming back from Iraq/Afghanistan with shaking like that. 

[Video containing example of shaking and tremors](https://youtu.be/SS1dO0JC2EE)",explainlikeimfive,"Eli5: First World War ""shell shock"""
Kameleon286,1594706345,"If someone takes an ibuprofen, Xanax, gas-x, it works only for a short amount of time, but if they take vitamins or other daily medications, it works all day long. How does this work?",explainlikeimfive,"ELI5 why some pills work all day, whole others work only for an hour or two"
bezm12,1594706339,,explainlikeimfive,ELI5: What are some noteworthy research studies or research outcomes that have come from the ISS in the last 5~6 years?
Avocadosandtomatoes,1594706222,"I’ve seen the term used for night photography. 

What exactly is happening?",explainlikeimfive,ELI5: what is image stacking when referring to photography in post-production work?
slid3r,1594706209,[removed],explainlikeimfive,"ELI5: Vaccines, did we get one for the Spanish Flu? Do we stand a chance now?"
technodoki,1594706112,,explainlikeimfive,ELI5: Why do government broadcasts have sign interpreters instead of just subtitles?
slid3r,1594706111,[removed],explainlikeimfive,"ELI5: Vaccines. Spanish flu, did we get one? I can't get a straight answer. Can/will we we get one for Covid? I am generally scared."
Kameleon286,1594705820,[removed],explainlikeimfive,ELI5 how I can take a vitamin once a day and it works all day
taleoftooshitty,1594705767,,explainlikeimfive,ELI5: What are the anatomical/physiological differences between vocal ranges (i.e. soprano vs bass)?
72iobkcuf,1594705667,"I've read thru reddit and Google and everyone has given pretty biased answers. Alot of ""watch the doc"" answers too. I've seen alot of his greatest races, I just want to get a simple unbiased answer on the subject.",explainlikeimfive,ELi5 Why is Ayrton Senna considered the greatest F1 driver of all time?
deartothesun,1594705572,[removed],explainlikeimfive,ELI5: How will a vaccine work if COVID-19 antibodies only last a couple of months?
_JP3_,1594705509,,explainlikeimfive,ELI5: How come you can be about to say something and then quickly forget it and not be able to remember it even though it was on the tip of your tongue.
Xenomorph383,1594705447,,explainlikeimfive,"ELI5: So fish need oxygen to breathe, but how come they can’t breathe out of water? Is it due to the fact that they need the water-breathing process that gills use to transfer the oxygen?"
flamethrower78,1594704448,,explainlikeimfive,ELI5: When and how did the Democrat and Republican parties switch sides in the 1800s?
Hjkouni,1594704332,"I don't quite get it, I understand its related to change in prices over time, by does it occur at a steady rate or is it dependent on external factors?",explainlikeimfive,Eli5 how does inflation work?
ballonrock,1594704005,,explainlikeimfive,"ELI5: What's the difference between a condition, disorder, disease and syndrome?"
hobrien123,1594703754,When I consistently sleep 8 hours I feel well rested and even alert when I wake up. But after sleeping 10 + hours I feel groggy as hell for ages after I wake up and it’s harder to motivate myself to do stuff. Shouldn’t you feel more rested the longer you sleep?,explainlikeimfive,ELI5: Why is it sometimes really hard to wake up after you have slept for a long period of time? Shouldn’t you be well rested?
BIgToes4Sale,1594703695,[removed],explainlikeimfive,Why don’t my veins break more easily?
LateNightPhilosopher,1594703503,"Certain brands seem to always have a very high amount of unpopped kernels and air in the bag, while others always seem to be filled to bursting with barely any kernels. I've tested different times and microwaves and it usually ends up the same, with the brands seemingly being the deciding factor.",explainlikeimfive,ELI5: Why do some popcorn brands seem to have a much higher proportion of dud kernels vs popped corn than others?
Fidodo,1594702868,What kind of tools do they have that we don't have? I look for news from a few years ago all the time and have a really hard time finding sources I know I saw years ago because the keywords overlap so much with new events. On TV I see clips from years ago about specific events re-found that I can't find myself. How do they do that?,explainlikeimfive,ELI5: How do news and late night shows track down obscure news clips on a subject?
LogDog0,1594702664,[removed],explainlikeimfive,Eli5 Why is it that if I wake up naturally at 5:30 I can get out of bed no problem but if an alarm wakes me up at 10 it's a chore to get moving? Even if I wasn't anymore or less tired when I went to sleep and I started at the same time. Is there a psychological or physiological explanation?
forevernevereverfor,1594702649,,explainlikeimfive,ELI5: Why are our hands lighter than our face?
thebuddywithglasses,1594702496,,explainlikeimfive,ELI5: How can tapping help a baby fall asleep?
lackingnothing,1594702427,"Is it true that there is an ‘alpha female’ and every other girls menstruation period will fall in line with hers? What’s the science behind this? Whether it was me staying in the dorm with my girlfriends and being with them day in or day out or even now just in the house with my mom and sister, this phenomenon seems to occur and I’ve heard it’s that girls sync periods but why?",explainlikeimfive,"ELI5: Explanation of how after an extended amount of time together, a group of women will begin to experience synced period cycles?"
Tu_-Tio,1594702425,,explainlikeimfive,ELI5: Why the entertainment industry rarely releases the pilots/original concepts of famous series and movies ?
yastika07,1594702075,"So, during the lockdown my sleeping pattern has gone for a toss and I've found that staying up till dawn and studying then has somehow improved my concentration and focus",explainlikeimfive,ELI5: Does sometimes exhaustion improve concentration/focus?
Airyx,1594702008,"This might just be me and not a scientific answer for this sub, but it feels like when I go to sleep late, I will be more tired than if I had gotten fewer hours but slept earlier, regardless of how many hours I sleep for. Is there some sort of known phenomenon to explain this, or is this just something that happens to me?",explainlikeimfive,ELI5: Why does it feel like time that I go to sleep matters more than hours I’m asleep for?
bradfo83,1594701874,,explainlikeimfive,ELI5: why is tinfoil always used as the go-to non-detection substance? Especially with the recent news re: Maxwell- is there any science or legitimate history in it?
high_dino420,1594701281,,explainlikeimfive,ELI5: What is behavioral priming and how does it work?
richinreverse,1594700716,[removed],explainlikeimfive,"Eli5: If everything is made of atoms, why can't we eat anything?"
SombreLook,1594700704,"In theory, if they could (they probably couldn't dump their entire assets because of investors and stuff), what would happen if they could liquidate their entire net worth and then give away nearly all of it to random people to spend immediately in the economy? 

Would there be any positive or negative reactions due to this? 

Would it just inflate currency or would it create a massive vacuum for other wealthy people to fill? 

Any help please, always wondered this.",explainlikeimfive,ELI5: What would happen to the economy if the top 10 most wealthy people dumped their entire net worth into charities or donated to random people to spend?
yastika07,1594700587,[removed],explainlikeimfive,ELI5: Why do I study better when I'm sleepy/tired?
FifaRidiculousScript,1594700217,,explainlikeimfive,"Eli5: Why in the US do you get taxed on payday, taxed on purchases, and come tax season, you may have to pay more taxes?"
Dingleberrydreams,1594700097,[removed],explainlikeimfive,Eli5: What is the Mercosur Trade Agreement and why are some people against it?
SeattleStudent4,1594699879,,explainlikeimfive,ELI5: Why are physical passports necessary in 2020? Why isn't there an optional system in place which uses fingerprints?
bluepowerrangerbob,1594699629,Shouldn’t the lighter skin tone reflect the suns rays?,explainlikeimfive,"eli5: If lighter colors reflect light and darker colors absorb it, then why do pale people sunburn easier?"
rk5213,1594699117,How does massaging a sore body part help the body part to feel better?,explainlikeimfive,ELI5 : How does massaging make you feel good?
trackedu,1594698731,,explainlikeimfive,Eli5: What are the functions of different parts of the brain?
mellowyellowfelloww,1594698654,,explainlikeimfive,ELI5: Why do some of us feel dizzy/faint after thinking about or seeing blood?
dan-danny-daniel,1594698635,,explainlikeimfive,"ELI5: Why do people naturally describe the size of a Rubik's cube as 3x3, 4x4, 5x5, etc., when could could describe them as just 3, 4, 5, or, for maximum accuracy, 3x3x3, 4x4x4, 5x5x5?"
mellowyellowfelloww,1594698466,[removed],explainlikeimfive,ELI5: Why do some people feel dizzy/faint after thinking about or seeing blood?
mellowyellowfelloww,1594698353,[removed],explainlikeimfive,ELI5: Why do I (and many others) feel faint after thinking about or seeing blood?
kitaoiserebaa,1594698068,"I knew it moves from hot area to cold. But today, our teacher said that it always moves upwards. Can somebody explain?",explainlikeimfive,ELI5: Why does heat always move upwards?
jackanapes8,1594697036,,explainlikeimfive,"[eli5] Autism, the autism spectrum, and the difference between Autism and Aspergers"
GoAhead_BakeACake,1594697011,[removed],explainlikeimfive,"ELI5: Do house cats see their owners as overgrown cats with alopecia, or do they recognize them as a different species?"
SubaruSucks,1594696730,"Up here in Minnesota with lots of diverse weather, it seems that winter storms last longer, are bigger than (area-wise), and move slower than summer storms. I've seen lots of winter storms and blizzards that seem to last at least 12 hours and dump snow continuously the entire time. However, I've only seen a couple of rainstorms that last that long and rain somewhat consistently. Rainstorms almost always seem to move in a relatively thin band across an area while snow storms hover and are much more spread out on the radar.

Is this just my imagination? If not, why does this happen?",explainlikeimfive,ELI5: Why do snow storms seem to move slower/last longer than rain storms?
Oghmand,1594696566,"if you can also link an article for more information, would be awesome. Thanks.",explainlikeimfive,ELI5: How does music from a microphone pass to the computer?
