author,created_utc,selftext,subreddit,title
dflanigan19,1594491541,[removed],explainlikeimfive,ELI5 Why can’t I eat the guys of a scallop but I can eat a whole mussel or clam?
Razmondfield955i,1594491485,"Was having a discussion with a coworker today, you always see people being moved around while accelerating or cornering spaceships in sci-fi movies, would you be feeling those forces like would on earth?",explainlikeimfive,ELI5: Can you feel G force in space?
PoopStickss,1594491285,,explainlikeimfive,Eli5 how calls and puts work and how the brokerage and person make a profit?
tjmaxal,1594491164,[removed],explainlikeimfive,ELI5: Why do I start sweating more when I enter a cool area from a hot one?
Vergelsmozes50,1594490720,[removed],explainlikeimfive,[ELI5] What is dual channel in ram? Why do i have to put a space between them? Also can ram be like 8gb on one channel and 24gb on the other?
MARCELfromPARCEL,1594490693,[removed],explainlikeimfive,ELI5: Invesments in China
landerson22,1594490129,"Wouldn’t there be a point when it only matters that you can drive the car, and the way the car is designed will determine the winner?  As far as I’m aware, the races are just circles.  What is it that makes some racers significantly better than others?",explainlikeimfive,ELI5: How are there NASCAR drivers who are better than others?
purplish_phoenix,1594489924,From what I googled it seems to be a ‘super fan’. But it seems the term stan is more convoluted then that and with social media has changed to mean something else.,explainlikeimfive,ELI5: What exactly is a stan?
Jonde_psn,1594489823,[removed],explainlikeimfive,"What defines if music is edgy ""eli5"""
purplish_phoenix,1594489567,From what I googled it seems to be a ‘super fan’. But it seems the term Stan is more convoluted then that and with social media has changed to mean something else.,explainlikeimfive,ELI5: What is a Stan in relation to a fandom?
sitilge,1594489566,,explainlikeimfive,ELI5: How do they improve the quality of old movies?
Papayamoney,1594489531,"Hello everyone, i'm getting into code recently and i have heard these terms a lot.

Can someone explain what are they? And if you have a good source or tutorials to learn API, you can leave the link in the answer.

PD: apiacademy.co has free courses and certifications about API, but i don't know ,if they are good and if would be easy to follow with zero knowledge.

Thank you!!!",explainlikeimfive,eli5: What is sn API? And the differences between API and API REST?
onetesseract,1594489482,,explainlikeimfive,"ELI5 what Böse-Einstein condensates are, and where (if anywhere) they can be found naturally occurring?"
jonasirate,1594489115,[removed],explainlikeimfive,"ELI5: How does the evolution of the human body work? How can ""it"" know what we need and adapt our body to that over 100 thousands of years?"
purpleDONKEY99,1594489085,,explainlikeimfive,ELI5 What actually provides the thrust for space shuttles to lift off?What shoots out the bottom of them?
[deleted],1594489000,,explainlikeimfive,ELI5: Why do we keep on pressing bruises even if they hurt?
Ijustwantlove117,1594488997,[removed],explainlikeimfive,"ELI5: What is fascism and the ""alt-right"" what do they believe?"
ntvirus,1594488680,[removed],explainlikeimfive,ELI5: How exactly are web contents secure(d)?
crstnhk,1594488529,,explainlikeimfive,ELI5: Why do inflatables loose air over time even when there’s no hole in them?
therunaround818,1594488266,[removed],explainlikeimfive,eli5: What is “the dark web”?
peterpandacat13,1594488227,(I drink mostly white wine and champagne),explainlikeimfive,ELI5 Why does alcohol make you gain weight?
HuluAndH4ng,1594488176,[removed],explainlikeimfive,ELI5:How sub crews can hear other submarines essentially making noise in a submarine vs submarine situation?
isayitswhatever,1594487611,[removed],explainlikeimfive,ELI5: How dangerous is COVID-19 really and how cautious should I be right now?
eliphas8,1594487254,"So it just hit me that I have no idea why erasers actually erase a graphite pencil mark from paper, or why erasable pens work.",explainlikeimfive,ELI5: how do erasers work?
sunsaintDC,1594487051,[removed],explainlikeimfive,ELI5:How do construction companies just leave behind construction vehicles all the time? They seem like valuable and expensive tools.
humelectra2000,1594486927,,explainlikeimfive,"ELI5: If it's illegal to do drugs (like cocaine) and there's celebrities that openly admit they've done plenty of illegal substances in the not-so-distant past in interviews/conversations, how come they are not convicted?"
DeliriousAnimation,1594486333,[removed],explainlikeimfive,"Eli5: why does blowing ""hoo"" with our sound make cold air, while ""hah"" makes warm air?"
beerbellybegone,1594486198,"Does food spoil cumulatively, progressively, linearly, logarithmically, etc.?

Say I leave a carton of milk out for an hour then put it back in the fridge, what happens to the milk? Does it restore to the level it was before I took it out for an hour?

Say I do this 10 times before the milk spoils, is this related to how long it would take the milk to spoil if I just took it out once and left it out?",explainlikeimfive,ELI5: How does food spoil?
throwaway3699634,1594485746,"posted on r/nostupidquestions too

I was reading through a relationship advice post and a girl said they found fentanyl and GHB in her blood when she went to the hospital. But how do they know what to test for, they can't test for every single chemical so I don't know how they narrow it down so quickly, someone please explain it like i'm five.",explainlikeimfive,ELI5: How is blood tested for chemicals?
CheesyTortilla21,1594485028,[removed],explainlikeimfive,ELI5: Why do humans have only one hair color but animals have multiple?
CheesyTortilla21,1594484945,[removed],explainlikeimfive,ELI5 Why do humans have only one hair color and most animals multiple?
MrSlothlord,1594484865,,explainlikeimfive,"ELI5, How does a country go bankrupt?"
MasterScarn007,1594484316,And how does one reduce sweating excessively?,explainlikeimfive,eli5: Why do humans sweat?
BlankeSpace,1594484313,[removed],explainlikeimfive,ELI5: Why is my laptop lid open when I fell asleep with it closed?
aecee94,1594484233,[removed],explainlikeimfive,Eli5 Game theory in real life .. how can you implement it ?
Staklados,1594484205,,explainlikeimfive,"[Eli5] If a person didn't have a clue what the time or season was, how would one set up a solar clock to be able to know the time in that part of the year and in the future?"
BurritoZero,1594484127,,explainlikeimfive,ELI5: why can you not use shampoo as a substitute for body wash? What happens to your body if you use shampoo for body wash?
Beanstheenby,1594484118,,explainlikeimfive,Eli5: Have you ever made a bunch of chalk dust by scraping the chalk against the concrete or asphalt you were drawing on and mixed a bunch of different colored chalk dusts together? Why does combining all the colors make the dust white?
GoGraystripe,1594484052,,explainlikeimfive,ELI5: Why Can it Be So Hard to Sleep But Then So Hard to Get Up?
Deanosaurus88,1594483849,Inspired by another car post I saw on ELI5 earlier today.,explainlikeimfive,ELI5: What is an engine break?
piratejedi,1594483659,,explainlikeimfive,ELI5: Why do songs (or snippets of songs) spontaneously pop into my head and get stuck there on repeat?
Avrixon,1594483516,,explainlikeimfive,ELI5: Why does Hollywood keep producing terrible movie sequels?
hhowwddy,1594483401,[removed],explainlikeimfive,ELI5:Why female dog humps?
TheBusierBee,1594483366,[removed],explainlikeimfive,ELI5: Cytokine Storm vs Asymptomatic patients?
noprahwinfrey,1594483248,[removed],explainlikeimfive,ELI5: Why does hair turn grey earlier for some people?
regg_,1594483232,[removed],explainlikeimfive,ELI5: Why do you shiver after you pee?
THEBESTMIDDLENAME,1594483187,,explainlikeimfive,Eli5: Why is anyone in the executive branch allowed to commute a person’s sentence given to them from the judicial branch. I though we had checks and balances For this time of thing. Can someone explain this to me?
Vergelsmozes50,1594483087,So im new to college and im still dont know how to start and what to put on essays about a reading a teacher assigned.,explainlikeimfive,ELI5: How do you create essays without guide questions about a chapter
Radojka69,1594483072,[removed],explainlikeimfive,Eli5:why is the quality on security cameras so bad when our phones are a few times smaller and are not just cameras?
D_Tr0n,1594482825,[removed],explainlikeimfive,"ELI5: How do ridiculous items end up selling for exorbitant prices on EBay, &amp; how often are these final bids actually paid out?"
Azifor,1594482677,"Medications are made that work on a large number of items. They have some of the craziest creations/chemicals that do very specific things in the body. They also have some wild treatments like facial transplants for example (glad it works but why did someone try that in the first place). Another RP-G28 is supposed to help lactose intolerance people in the future. Anti depression or anxiety meds use certain chemicals...

How are these found/trialed on humans?  

Do simply they just try one random thing after another until something works? I kinda doubt that. Is there some underlying biology ""code"" that they derive these ideas from?",explainlikeimfive,ELI5: How do they figure out the chemicals to put in drugs or any of the other crazy treatment ideas?
Amerwolv,1594482532,[removed],explainlikeimfive,ELI5: Why can’t the US just print money and forget about debt?
HoneyBadger162,1594482324,[removed],explainlikeimfive,ELI5 Why am i shaking when hungry?
pitz_f,1594482208,[removed],explainlikeimfive,ELI5 - Can humans eat nutrients without consuming plants not animals?
xXChivalryXx,1594482032,,explainlikeimfive,eli5: Why were dinosaurs so massive compared to anything today?
Greenman_96,1594481865,,explainlikeimfive,ELI5: How do positive displacement and dynamic displacement pumps move liquid through a system?
Greenman_96,1594481689,[removed],explainlikeimfive,How do positive displacement pumps and dynamic displacement pumps move liquids through a system?
greenbastardette,1594480936,,explainlikeimfive,ELI5: are there any legal ramifications for baseball players “opting out” of playing a season? Aren’t they under contract?
greenbastardette,1594480818,[removed],explainlikeimfive,"ELI5: how can baseball players “opt out” of playing a season, even if it is because of COVID? Aren’t they under contract?"
SillySavageGoose,1594480719,How can you freeze an image of reality onto a tangible surface?,explainlikeimfive,eli5: How exactly do photographs work?
General_PoopyPants,1594480660,[removed],explainlikeimfive,ELI5: What's going on with Wayfair?
Kira-0,1594480629,,explainlikeimfive,ELI5: Why mercator projection is still being used Instead of better projections that shows actual sizes?
lol_camis,1594480573,Just seems weird to me that the best design for comfort and efficiency isn't too far off from the best design for speed and handling.,explainlikeimfive,ELI5: Why are race cars roughly the same size as consumer passenger cars?
tinocasals,1594480403,"I'd say it has to do with recognition but, does it really work? Am I missing something?",explainlikeimfive,ELI5: why bank robbers wear panties in their heads.
Kira-0,1594480330,[removed],explainlikeimfive,ELI5: why do we use wrong world map (Mercator projection) instead of better projections that has actual sizes?
dromedront,1594479949,,explainlikeimfive,Eli5: What is a bureaucracy.
bunnysnitch,1594479703,[removed],explainlikeimfive,ELI5: why can't I just buy my own insurance?
tommytopcheese,1594479691,I just finished watching Waco on Netflix. Still having trouble understanding the 7 Seals. Is it suppose to be something only the second messiah or coming of Jesus can open and know what they are? Or is there a basic understanding of the 7 Seals? Thanks. Also any insight on the book of revelations would be great. What religions study it? Adventist’s? Catholics? Thanks.,explainlikeimfive,ELI5: The 7 Seals and the Book of Revelations?
TSM_Raven25,1594479633,"I believe every single time I've looked at a car's rims when the car is moving fast, it appears like it's going in the opposite direction. If  you're looking from the left side and the tyre is going anti clock wise, the rims would appear like they're moving clock wise. why is that?",explainlikeimfive,"ELI5: Why is it when a car is moving fast and you look at the tyre's rims, it appears like it's going in the opposite direction."
Hatake88,1594479320,,explainlikeimfive,[eli5] Why does anger feel so good?
PajamaMamma,1594479218,[removed],explainlikeimfive,U.S Coin shortage
ChaoticWriting,1594479145,[removed],explainlikeimfive,ELI5: What annihilates particles when Quantum Fluctuations occur in a Perfect Vacuum.
Erratic-Monkey,1594478736,[removed],explainlikeimfive,What the hell is autism I dont know tell me I have seen it everywhere and I'm lazy to Google tell me in detaile eli5
moussadel,1594478646,,explainlikeimfive,ELI5: How does natural selection explain homosexuality?
Ohtapp,1594478381,[removed],explainlikeimfive,ELI5: What happens when a feeling triggers a smell?
fiddel_fabulous,1594477825,"I have heard of a few copper or silver printing inks that can do this but not much else as a mainstream type of product. What are the limitations of  using a home printer to make PCB boards? 

Is it the ink, the printer paper or plastic that need research? 

I dont understand why i can buy a material to print on and special pcb ink to make pcb's at home. Thanks for you help.",explainlikeimfive,ELI5: What are the limitations of using an inkjet printer to make PCB at home?
BinaryPeach,1594477801,[removed],explainlikeimfive,"ELI5, how is it possible for my Bluetooth mouse to run for three years off of a single AA battery, and my phone's battery gets cut in half when I use my Bluetooth headphones?"
TldrDev,1594477796,[removed],explainlikeimfive,ELI5: Why does the rate of new Coronavirus infections rise and fall throughout the week
fabbio32,1594477747,[https://www.youtube.com/watch?v=yQeQwwXXa7A](https://www.youtube.com/watch?v=yQeQwwXXa7A),explainlikeimfive,ELI5: Is it possible to create energy with a device like this?
Fckspeakup,1594477655,[removed],explainlikeimfive,Etmli5: How is wind created?
DirtySingh,1594477431,,explainlikeimfive,ELI5 How much money would billionaires and multi-millionaires lose if they paid the taxes they owe or higher taxes? Do all these offshore holdings save them that much? Eli5
DirtySingh,1594477019,[removed],explainlikeimfive,How much money would billionaires and multi-millionaires lose if they paid the tax they owe or higher taxes? Do all these offshore holdings save them that much? Eli5
ernore,1594476182,Example: wine making you more relaxed and sleepy as opposed to tequila being more of a “party” drink.,explainlikeimfive,ELI5: Why do different types of alcohol give you different feelings?
thepinkpanda1,1594476069,,explainlikeimfive,ELI5: Why is the video quality on Snapchat on Android phones so bad?
slowpokesardine,1594475986,[removed],explainlikeimfive,ELI5: Why do dogs wag their trail when happy?
HahaUsrname,1594475800,"Hi. I'm becoming interested in cars and how they work.

What is damping and how does it affect suspension and what does it do? (or dampening, idk if they are 2 separate words or are interchangeable)


(I'm only 13 so a really simplified answer  would be appreciated, I don't understand any sort of complicated physics)

Thanks in advance.",explainlikeimfive,"ELI5: What is ""damping"" (car suspension)"
UnknownUsername_,1594475747,Ok I understand software and how that works... But how does the initial part of hardware begin it's journey to no longer being a current to being I assume binary code?,explainlikeimfive,Eli5: how does computers/TVs change electric to readable software
letsdreamforever,1594475274,[removed],explainlikeimfive,ELI5: Why do we use only one side better? Are there people who use both sides equally well?
sph44,1594475268,[removed],explainlikeimfive,ELI5: Why is it that 25 C (77 F) air feels hot to most people (or very warm) but 25 C (77 F) water feels very cold to the body when you jump into a pool...?
letsdreamforever,1594475129,[removed],explainlikeimfive,ELI5: Is it congenital for being right-handed and left-handed? Are there people who use both sides equally well?
RicardoMilossGoa,1594475070,[removed],explainlikeimfive,"ELI5: How do painting and jewel thief's, sell extremely expensive stolen goods without, getting traced?"
mystoopidusername,1594474729,[removed],explainlikeimfive,ELI5: Why do some people react more uncontrollably than others when being tickled?
Worst_Artist,1594474138,[removed],explainlikeimfive,ELI5: What data is Tik Tok collecting on your mobile device that other apps aren’t? I don’t understand what it can be allowed to collect more than other apps have permission to.
Wizkev,1594473604,[removed],explainlikeimfive,ELI5: Why is yawning contagious?
sneakymooseattack,1594473122,"From an outsider's perspective, it seems like they're just small, man-made lakes. People swim and fish in man-made lakes all the time. What's different? Couldn't you just make retention/detention ponds the same way?",explainlikeimfive,ELI5: Why is it that Retention/Detention ponds aren't built for swimming?
KMarcell03,1594472904,"Ive seen this post about the cross section of an old calculator :
https://www.reddit.com/r/interestingasfuck/comments/hp6yzh/the_open_side_view_of_an_antique_calculator/?utm_medium=android_app&amp;utm_source=share

This got me thinking how do these work exactly? I reckon they have a bit system of sorts, but are these only on or off (0, 1) or do they have more variety. 
And could you do get the square root of something on these machine or could you only do the basic operations?",explainlikeimfive,ELI5 how does a mechanical calculator work?
sneakymooseattack,1594472846,[removed],explainlikeimfive,ELI5: Why don't people make Retention/Detention ponds for swimming?
howismyspelling,1594472835,,explainlikeimfive,Eli5: why do vinyl wrap installers only use a heat gun for certain things rather than the entire car?
AcidicGxGaming,1594472520,[removed],explainlikeimfive,Eli5 Why am I attracted to sticks
creeper321448,1594472396,,explainlikeimfive,ELI5: Why do our teeth sometimes grow in a crooked manner that is detrimental?
KMarcell03,1594472251,[removed],explainlikeimfive,How does a mechanical calculator work eli5
HoboSquad,1594472015,[removed],explainlikeimfive,ELI5: Why do so many people think there will bebig city exodus after the coronavirus ends?
HolyMotherOfGeedis,1594471819,"Background: I'm writing a collaborative story with a friend, and there's a railgun involved. Two of our characters are supposed to have a big fight ""at the railgun"" but that's a very vague way of putting it. We come up with the details together, but I'm the one doing all the big writing parts, and the research that comes with it. All google searches result in ""railgun physics"" and things like that, but I need to know what the people involved with it are doing. A part of me doubts only a single person operates a railgun.

So is there a facility? Are people directly next to the railgun? Is one person right by it, while others are in the facility? What does everyone in the hypothetical facility do?

tl;dr The people who operate a railgun- what do they do and what are their positions/jobs, and from what location do they perform their jobs?",explainlikeimfive,"ELI5: Who operates a railgun, and what do they do?"
zegolas,1594471696,"[Walking under a boat underwater](https://www.youtube.com/watch?v=G5LBjuAasnQ)

How is this accurate science wise, if it is. What does it take?

&amp;#x200B;

Thanks",explainlikeimfive,ELI5: The science of how Jack and Will walk underwater in Pirates of the Carribean
EatenAliveByWolves,1594471480,,explainlikeimfive,"Eli5: Derivatives. The U.S.A has 687 trillion dollars of ""currency and credit derivatives."" What exactly does this mean?"
user01120,1594471452,,explainlikeimfive,ELI5: How do scientists figure out how many calories are in a food?
kaLiiaa,1594471439,,explainlikeimfive,ELI5 how it rains when there no or very little clouds
CairoMarquez,1594471378,[removed],explainlikeimfive,Eli5: Why do i feel hungover the day after a big meal?
reubenfinlay,1594471242,Everytime I google or ask people I get more confused.,explainlikeimfive,"ELI5: What does ""based"" mean?"
sexythrowaway887,1594471045,,explainlikeimfive,ELI5: Hulk Hogan peaked in popularity around the late 80s to early 90s in the WWF. Why is he considered the first major superstar in the industry still even today and still gets brought back for special appearances?
peepoglab,1594470711,[removed],explainlikeimfive,ELI5:How do you die from lack of sleep?
mehjenta,1594470552,[removed],explainlikeimfive,What is preventing the inquiry into the death of Breonna Taylor and the arrest of the cops involved in shooting her?
potato_smasher1,1594470337,[removed],explainlikeimfive,ELI5 What is happening when you get the weird butterfly feeling if you do down on a roller coaster? Or in your car going down a dip in the road?
jannyuses,1594469817,"Take the people running away from Daenerys' dragonfire onscreen in season 8 of game of thrones, or any other thing alike as an example, how were so many small extras trusted with such crucial information




Do the producers lie to them to avoid them giving away the right information and say it's just something else they're running away from? Do they all really know but are so good at keeping it secret?",explainlikeimfive,"ELI5: How are movie extras entrusted with the biggest (or smallest) details of a movie's plot before its release, to avoid spoiling?"
chrishasrisen88,1594469701,,explainlikeimfive,Eli5: Why do electrical items stop working in water whats the science behind it ?
GamesRealmTV,1594469556,,explainlikeimfive,"ELI5: Why does lack of sex makes me/us feel always so charged up, no matter how much I work, at the end of the day it always makes me feel that I'm at 100% potential."
tmoore223,1594469458,,explainlikeimfive,ELI5: Why does squirming/dancing around while standing up help someone from peeing their pants?
anti_vist,1594469239,,explainlikeimfive,ELI5: Why is it that when we wake up our faces are all worn and rugged and become “tight” again as the day progresses?
iahimide,1594469174,,explainlikeimfive,"ELI5: how come our eyes didn't adapt and it still seems too bright outside during the summer, even though we lived outside for thousands of years?"
ALittleLess16Candles,1594468839,"Like how does air pressure work? If a soccer ball is 6 psi it doesn’t look flat, but it feels it. What’s in there that air takes the place of? Is it nothingness?",explainlikeimfive,ELI5 What’s in a ball when it is flat?
abasicgirl,1594468243,,explainlikeimfive,ELI5: what exactly causes the after-image you get from looking at something bright? What determines how long it lasts?
Saqiillies,1594468050,,explainlikeimfive,"ELI5: Why is the sky blue during the day, black at night, and different colors at sunrise and sunset?"
ButItWasMeDio,1594467776,"Basically, how are these deals set up so that they are worth it both for the publishers and the hardware owners?

Say Capcom wants to release a game and Sony pays them to only release it on PS4. How is it worth it for Capcom unless Sony pays them more than the total predicted sales on Xbox/Switch/PC? However, Sony would probably lose money if they did that.

(I know some exclusivity deals are temporary but I mostly mean the ones that aren't.)

I understand that in some cases, smaller software companies take these deals because they need the money to develop/publish the game in the first place. But these deals often involve huge companies that certainly CAN pay upfront for the game. So how does it work?",explainlikeimfive,ELI5: How are exclusivity deals for video games worth it?
GFAJ,1594467322,"We all know the dramatic movie scenes where the doctor shouts ""CLEAR"" rubs 2 pieces of metals and places them on the patients body which revives him. Is this in any way realistic? What does a defibrillator do?

I say it is used to reset the heart and stop dangerous arythmia

Person B says that is used if the person's heart has stopped beating for a small amount of time",explainlikeimfive,ELI5 What does a defibrilator do?
AnonRedit7777,1594467152,[removed],explainlikeimfive,"Eli5: When ""people"" ""demand"" Trump's ""Tax Return"" what do they mean and what do they actually expect it to show?"
CatDad35,1594466945,[removed],explainlikeimfive,ELI5 - What did New Zealand do to eradicate Corona that the rest of the world isn't doing?
Hatake88,1594466672,"Hey guys

I'm not trying to be judgemental at all but I've always been curious as to the appeal of BDSM. 

From a layman's perspective, it seems cruel for the more dominant partner to beat the more submissive person - and I've heard instances where the (consensual) hitting occurs purely in the punishment sense (for example, because they've spoken out of turn or broken a cup). From the more submissive partner's POV, I don't understand why a fully grown adult will want to obey to another's command and lose their autonomy.

Again, I'm not trying to diss the idea but I was wondering what the psychological basis underlying BDSM is? Either from a clinical POV or from an emotional POV...",explainlikeimfive,[ELI5] What is the appeal of BDSM? What is the psychological need being scratched?
TheFancyUnicorn1,1594466530,Or to the same effect. Why does draught beer taste better than bottled beer even if they're the same beer,explainlikeimfive,ELI5: Why does restaurant/on tap coke taste better than bottled coke
