author,created_utc,selftext,subreddit,title
mwilliams7187,1595208496,[removed],explainlikeimfive,"ELI5: If our Sun is a Star, does that mean most of the stars I see at night are also Suns with planets rotating around them?"
salzal,1595208420,[removed],explainlikeimfive,"Eli5: If wearing a face mask doesn’t reduce oxygen levels, then why does it feel hard to breathe when wearing them?"
[deleted],1595208362,,explainlikeimfive,Why are horse shoes necessary when they seem to do just fine in the wild? Eli5
Bar_Delicious,1595208332,[removed],explainlikeimfive,Government
GarbageMiserable0x0,1595208225,[removed],explainlikeimfive,Do you want to get free games and prizes in your free time? eli5
Icey_Pizza,1595207930,[removed],explainlikeimfive,"ELI5: How is water able to put out fire? If fire needs oxygen as fuel to burn, then wouldn’t the oxygen atoms in a water molecule fuel the fire?"
schnikyy,1595207704,,explainlikeimfive,ELI5: Why do skin indentations from tight clothings feel so itchy?
ashinypennyforthough,1595207461,,explainlikeimfive,Eli5: why do you get hot when you exercise?
Bar_Delicious,1595207411,[removed],explainlikeimfive,Government
Afireonthesnow,1595207376,,explainlikeimfive,ELI5: How do scientists know how much greenhouse gas is emitted by a country?
atheistCuntTM,1595207319,"While speaking I often forget a word, even if it's in my native language and can only remember in the other language (for example ""retirement"", a word that I often forget the equivalent in Portuguese, which in fact I can't remember rn xd). 

And I found out recently that my friends have the same problem. Aren't languages stored in the brain in different ""drawers"". If so why does this happen.",explainlikeimfive,"eli5: Why do bilinguals switch words, or forget them, even in their native language"
TheReddOne,1595207022,[removed],explainlikeimfive,ELI5: How is a US president able to run again after being impeached?
EdenTrails23,1595206880,Sometimes storms are huge and have so much more rain than just a little sprinkle. So what causes the cloud to start raining when it can be such a varying amount of rain?,explainlikeimfive,ELI5: What makes a cloud ready to start raining?
Weshomedog,1595206873,,explainlikeimfive,ELI5: Why is it that there seem to be no more Battleships in modern navy fleets?
Bar_Delicious,1595206506,[removed],explainlikeimfive,Home rule
[deleted],1595206406,,explainlikeimfive,ELI5: What makes colorful things that color?
[deleted],1595205893,,explainlikeimfive,ELI5: why do we often cry when we see someone else crying?
gamelover99,1595205765,,explainlikeimfive,ELI5: Why is there a limit to human intelligence? Why haven't we seen super intelligent humans who can solve complex theories and problems in like a week or month?
Wolfblood-is-here,1595205419,"It seems both domestic animals like sheep, and wild animals like deer, are considerably more likely to flee from a person walking towards them than a car driving towards them, despite the latter being bigger, faster, and louder. Is it just that they don't recognise the car as a predator but do humans? Why do other noises, like a gunshot or missed arrow, scare them when a car engine doesn't?",explainlikeimfive,"ELI5: Why do certain animals avoid people, but not moving cars?"
[deleted],1595205234,,explainlikeimfive,eli5: Why did countries bother locking down at all in the first place if they don't care about doing it again now the numbers are worse? (USA for example)
AppleberryJames,1595205196,[removed],explainlikeimfive,ELI5: Why is a resting heart rate over 100 damaging to the heart but your BPM being 100+ while exercising isn't?
jt1132,1595205185,[removed],explainlikeimfive,"ELI5: What is inflation, and why does it happen?"
GokueVegetaMan,1595205022,"This question was inspired by this questions top answer: [https://www.reddit.com/r/explainlikeimfive/comments/hqze9w/eli5\_if\_the\_universe\_is\_always\_expanding\_that/](https://www.reddit.com/r/explainlikeimfive/comments/hqze9w/eli5_if_the_universe_is_always_expanding_that/)

&amp;#x200B;

&amp;#x200B;

Obviously there can't be some magical wall that prevents you from going further so if you could somehow go to the point that's ""the end of the universe"" what would be there to prevent you from going further?

&amp;#x200B;

Is the universe a globe like shape that would bring you back to where you started or what?",explainlikeimfive,ELI5: If the universe is constantly stretching what would be at the very end?
LikeTotallyBob,1595204970,[removed],explainlikeimfive,"ELI5: This may have been asked already, but what can Trump really do if he’s not re-elected, when it comes to leaving office? Has any past president refused to vacate the premises before?"
[deleted],1595204673,,explainlikeimfive,ELI5: why do I get dizzy from spinning for 10 seconds while other animals don't?
[deleted],1595204543,,explainlikeimfive,ELI5: how can my dog chase her tail for 45 min straight and be perfectly fine but if I spin for 10 seconds im dizzy and fall over?
ItzJDForRealz,1595204513,"I was taught that the internal bus connected CPU and memory and everything else that wanted to communicate with CPU and/or memory did so via an external bus.

Am I wrong or on target?",explainlikeimfive,ELI5 Internal vs External computer buses.
BRN_North,1595204483,[removed],explainlikeimfive,Having a baby! Have insurance question
ItzJDForRealz,1595204418,[removed],explainlikeimfive,Internal vs. External Bus in a computer (ELI5)
Daniel_Wareham,1595204123,Edit: I’m sorry I meant the first law of thermodynamics.,explainlikeimfive,"ELI5: how did they create the second law of thermodynamics? Did they just go “it’s never happened before, so it won’t happen in the future”?"
[deleted],1595204002,,explainlikeimfive,"ELI5: How did the “no energy can be created or destroyed” law of physics get created, did they just go “it’s never happened before, so it won’t happen again”?"
yutaka731,1595203942,I hear it all the time when I watch NASCAR. What does it mean when a race car is loose? Why is it bad? How does it get loose? Can you prevent it from getting loose? Can fix it while you're racing? I am guessing being too tight is also bad?,explainlikeimfive,ELI5: What does it mean when a race car is loose?
[deleted],1595203722,,explainlikeimfive,Eli5:If Fellings are visible
[deleted],1595203559,,explainlikeimfive,ELI5:Dying when lying
PhenderMan,1595203546,"I'm not completely oblivious as I understand ARPANET was military network precursor to the internet. The way I understand it is CompuServe and others like it were online services, but not necessarily the ""internet"". The WWW was the HTML system developed at CERN which was able to link disparate networks together through links called hypertext. 

Point being, I basically understand the difference between the WWW and the internet, but it's the in-between and edges I don't really get.",explainlikeimfive,ELI5: WorldWideWeb v. Internet v. Subscription services (e.g. CompuServe) v. ARPANET
saurabh1984bhattarai,1595203040,[removed],explainlikeimfive,ELI5 why I have feeling of uneasiness while trying to take a nap in the evening
Thalka07,1595202640,,explainlikeimfive,ELI5: why do the days in the summer have more sunlight hours than winterdays?
[deleted],1595202556,[deleted],explainlikeimfive,eli5 Are Bisexual men a real thing? What information is out there? And what does it say?
yellowdaisied,1595202348,Shouldn’t it always give you a stomachache? What determines how your stomach reacts?,explainlikeimfive,ELI5: Why does eating certain foods only occasionally upset your stomach?
TheBigBeardedGeek,1595202189,[removed],explainlikeimfive,ELI5: Why do cold sodas feel heavier?
Poutanara,1595202135,[removed],explainlikeimfive,Eli5. If when you get a fever your body temperature RAISES why do you need to be out in the cold to get one?
[deleted],1595202063,,explainlikeimfive,"If a fever RAISES our temperature, why do you need to be in the cold to get one? Eli5"
ExAl99,1595201848,[removed],explainlikeimfive,eli5: How would quantum computers change the world?
mmddev,1595201814,[removed],explainlikeimfive,"ELI5: If bats are immune to deadly viruses, why can't we study bats and use them to make something like vaccine or medicine or do something like genetic engineering to replicate the same level of immunity in humans?"
ect0_m9,1595201785,,explainlikeimfive,Eli5: Why when I'm out at sea on a boat (very far out) do I still get 5 bars of service?
Jkupar,1595201711,,explainlikeimfive,"ELI5: Why do sunburns hurt when touching hot water, but not cold water?"
[deleted],1595201708,,explainlikeimfive,ELI5: Why are cameras lenses circular but the captured image is rectangular?
[deleted],1595201622,,explainlikeimfive,ELI5 Why is clapping on one and three considered wrong/cringey/extremely white?
astridius,1595201541,[removed],explainlikeimfive,ELI5: why does the national debt even matter
astridius,1595201423,[removed],explainlikeimfive,ELI5: why does the national debt of America even matter?
paoweeFFXIV,1595201352,[removed],explainlikeimfive,ELI5: Why does re-plugging my USB dongle fix my wifi connection?
trytanic,1595201344,They're the same store. Why can't they all be called Real Canadian Superstore?,explainlikeimfive,ELI5: Why do some companies have different but very similar brands in different regions? I.e. Real Canadian Superstore and Atlantic Superstore
astridius,1595201286,[removed],explainlikeimfive,ELI5: Why does the American debt even matter?
Davenepeta,1595201080,"I know that all muscles produce lactic acid on stress due to a lack of oxygen, and that's what causes muscular fatigue, but what is the process the creates mental fatigue?",explainlikeimfive,ELI5: What causes mental fatigue?
droppingbasses,1595200587,[removed],explainlikeimfive,"ELI5: Since electricity will always take the path of least resistance, when and how does that “decision” happen?"
expensivebreadsticks,1595200514,[removed],explainlikeimfive,Eli5: How does the app Shazam work?
ayaofthesea,1595200121,[removed],explainlikeimfive,ELI5: Why is it bad to eat while standing?
SpongebabeTwitch,1595200080,"Sometimes when it's dark, if I look directly at something I cant see it at all, it becomes completely invisible, whereas if I look away from it (with my eyes rather than rotating my head/neck) I can see the outline of it, sometimes even quite clearly.
Am i imagining it because i know it's there and my brain is telling me that my eyes see it? Or do I actually see it better when I look away?",explainlikeimfive,ELI5: why do things appear clearer when you look away from them in the dark?
Knickersinatwister,1595199830,[removed],explainlikeimfive,ELI5: Why are we so curious about this sub? Why do we reach out to read somewhat useless information/trivia?
beemccouch,1595199825,[removed],explainlikeimfive,Eli5: How is there a most recent common ancestor to humans 3000 years ago if there are uncontacted tribes in Australia and brazil
bawzzz,1595199498,[removed],explainlikeimfive,Eli5: Do large data centres connect their servers to a dedicated ISP for internet?
BurritoSOFTWARE,1595199450,,explainlikeimfive,"ELI5: Why, when we close and open our eyes in the shower the first time, it takes 3 seconds to fully see, while right after we can see instantly?"
DutyInternational449,1595199256,[removed],explainlikeimfive,"ELI5: What is meant by ""exoticisizing"" other cultures."
thewildgerkin,1595198937,[removed],explainlikeimfive,How can we ourselves be generous when the world around us is based on greed?
alyrnouh,1595198921,[removed],explainlikeimfive,"ELI5 can someone please explain pre money valuation, post money valuation, price caps and discounts? please use numerical examples where money vluation is higher and lower than price cap"
MooshleBooshle,1595198633,[removed],explainlikeimfive,"eli5: Why do parrots replicate sounds, what purpose would it serve in the wild??"
elisxdd,1595197471,[removed],explainlikeimfive,ELI5: How do ip's work? and how do VPN's effect it?
BadAm3241,1595197272,[removed],explainlikeimfive,ELI5 how can you make AI to 'watch' something so it can learn by itself
randomshittinMe,1595197255,,explainlikeimfive,ELI5: Why does it take so much Force To push an air filled ball Into Water?
budvin_chathura,1595197182,[removed],explainlikeimfive,"ELI5 : What makes a passport ""powerful"" ?"
smort_potato,1595196934,[removed],explainlikeimfive,ELI5: What does a karat in diamonds mean?
Dream-Boat-Annie,1595196926,[removed],explainlikeimfive,ELI5: Virus a Non-Living Organism?
Benneck123,1595196813,,explainlikeimfive,ELI5: how can a single HDMI cable tell thousands of pixels what colourcolor they need to have?
ashleylibby,1595196610,,explainlikeimfive,ELI5: what is top-down/bottom-up analysis in economics?
[deleted],1595196487,,explainlikeimfive,ELI5: The reason for the substantial drop in US male testosterone levels since the 1980s
IDontHaveNicknameToo,1595196480,[removed],explainlikeimfive,ELI5: Is human eye empty inside?
nemo4879,1595196276,,explainlikeimfive,"Eli5: I was looking through some math terms on wiki and i came across a term called ""NP-Hard"" I have a general idea of what it is but beyond that It's sorta confusing. Can anyone explain."
EquivalentLake6,1595196243,"I had always thought it was just the first strongest sperm is the one that fertilizes the egg, but googling this topic / discussing with a friend now has me confused.",explainlikeimfive,"ELI5: How does sperm competition work when one female copulates with multiple males? Is it the first strongest sperm that reaches the egg the one that fertilizes, or can different strong sperms from different males compete all within a particular time frame?"
marat731,1595196185,,explainlikeimfive,ELI5: What actually is happening when your ears “pop” driving up a mountain or when flying?
Bababagginz,1595195276,[removed],explainlikeimfive,ELI5 Why is it that as a species we feel comfortable in a room with a temperature between about 62F to 75F? My understanding would make it seem like a comfortable temperature should be equivalent to body temperature.
ryebread1993,1595195254,"Why do the edges of those fluorescent acrylic sheets appear to glow, even when they aren’t being lit from a direct source?",explainlikeimfive,ELI5 Why does fluorescent acrylic glow?
[deleted],1595195201,,explainlikeimfive,"ELI5: When rich people buy a multi-million pound/dollar/whatever house, do they buy it outright or just have obscene mortgage payments?"
[deleted],1595195078,,explainlikeimfive,"Please ELI5 as to why the ""Just Right"" Temperature isn't body temperature?"
[deleted],1595195047,,explainlikeimfive,ELI5: What is the end goal of the black lives matter movement?
sun_m00n08,1595194911,,explainlikeimfive,Eli5 What is it about swimming that makes you SO hungry?
TooStrong55,1595194875,[removed],explainlikeimfive,ELI5: Life in Mars? What happened?
IUsedToHaveAmbition,1595194660,[removed],explainlikeimfive,"ELI5: Why do a lot of website login forms now only ask for email, and after successful submission, then they present you with the field to enter your password?"
Moratata,1595194621,,explainlikeimfive,Eli5: what stops animals from cross breeding?
[deleted],1595194502,,explainlikeimfive,ELI5: Why is saying all lives matter offensive?
whiskyforatenner,1595194477,,explainlikeimfive,ELI5: Watching antiques roadshow and they described a table needing to breathe. Of course tables can’t actually breathe so what exactly do they mean when they say that?
wet_suit_one,1595194258,[removed],explainlikeimfive,ELI5: Why does civilization work instead of not work?
musicsavage14,1595194140,[removed],explainlikeimfive,ELI5: How can (or does) the Milky Way retain a spiral shape over billions of years?
dan1ne,1595193951,[removed],explainlikeimfive,Eli5:I need help recording a video tape to a dvd using a Daewoo dvd recorder and a Targa dvd+video tape combination. Is it possible to do so?
[deleted],1595193798,,explainlikeimfive,Eli5 Why white supremacists believe they are superior to other races yet feel threatened or just make a fuss when minorities serve them food or hold minimum wage jobs
termitefads,1595193603,[removed],explainlikeimfive,"ELI5: why do we really need to preface our posts on r/explainlikeimfive with ""ELI5:"" ?"
termitefads,1595193412,[removed],explainlikeimfive,"ELI5: What would the effects be to someone with a ""neurolink"" implant, if we were to be hit by a powerful CME"
Networkbytes,1595192770,"Hi guys,

&amp;#x200B;

I have seen a few posts explain why it takes a few minutes for a phone to turn on after dying while you charge it, but no one has explained why it's such a big difference between iPhones and Android phones. An iPhone takes around 5 minutes (depending on the phone) before it can turn on again, while an Android phone takes around 20 seconds before you can turn it on after plugging in the charger.

&amp;#x200B;

EDIT: One thing to note is that this is not the case for Apple's laptops, those turn on immediately.",explainlikeimfive,"ELI5: How come iPhones take forever to turn on after dying, while Android phones can turn on the second you plug in the charger?"
dan1ne,1595192740,[removed],explainlikeimfive,How do I convert a video tape to a dvd eli5
Dibowac88N,1595192693,"Is It to get mroe margins back?. Or Is It so that people won't buy It till there Is supply again?.

 I don't know how this all works really.

Wondering since like PC Part products have gone I think.

\[19-07-2020\_23\_04.\]",explainlikeimfive,eli5: Why do prices Increase when there is a low demand?.
fuggeer,1595192659,[removed],explainlikeimfive,Eli5: Can someone turn my Corporate check into a third party check without me present
Billybob1138,1595192502,[removed],explainlikeimfive,"ELI5: Why it is considered racist for Trader Joe's to use ""Trader Ming’s,” “Trader José,” or “Trader Giotto’s” to refer to Chinese, Mexican or Italian food, respectively?"
isitjustme_-_,1595192013,[removed],explainlikeimfive,ELI5: How does verbal/emotional abuse effect the behavior/social life of victims?
Chex-0ut,1595191799,,explainlikeimfive,Eli5: How are there so many different flavors and styles of cheese if they all basically start out as milk
AfterAmbition,1595191632,,explainlikeimfive,"[ELI5] Why is albinism present across species, but we don’t see purple, orange and red humans, elephants, etc?"
fuggeer,1595191625,[removed],explainlikeimfive,Eli5: I have a couple questions
SwordOfTruth101,1595191606,[removed],explainlikeimfive,ELI5: How should I do a skin care routine? Currently I only have a acne cleanser and moisturizer. Is this good enough?
[deleted],1595191480,,explainlikeimfive,ELI5: Is the confederate flag offensive?
BlackEyedBeans22,1595191317,[removed],explainlikeimfive,"eli5 : Why is it that animals for example cats, take so little time to develop while human beings take years to develop. For instance a one year old cat can have babies and even survive on its own in the wild?"
LegitimateLemon3,1595191168,"I understand items that are hand painted will not withstand the heat of a dishwasher, but why would commercially sold items (ex: coffee mugs) vary so differently in their ability to be washed in a dishwasher? Wouldn’t it be better if everything were made to survive a wash cycle?",explainlikeimfive,"ELI5: Why are some kitchen dishes dishwasher safe, and others are not?"
corporal_cao,1595190815,"I woke up with this question on my mind. If chickens undergo their entire fertility cycle *pretty much* daily in order to produce eggs, what role does the male rooster play in sexual reproduction? 

Can any egg laid by a chicken hatch into viable offspring?",explainlikeimfive,Eli5: What is the role of roosters in egg production?
howdujudu,1595190696,[removed],explainlikeimfive,"ELI5: What would happen to our body if we contrast bath, i.e. take a cold(not icy of course) water bath immediately after a hot one(not boiling of course)?"
dan_irl22,1595190624,,explainlikeimfive,ELI5: How can a single storm have the rainfall of several years? It is saved up somewhere?
mattchew1993,1595190066,[removed],explainlikeimfive,ELI5: Can water from a dehumidifier be made drinkable?
[deleted],1595189960,,explainlikeimfive,Can air from a dehumidifier be cleaned and drank?
Zer0_90,1595189496,,explainlikeimfive,ELI5: Why do some clothes shrink when dried in the dryer but expand when ironed?
LicoriceMeat,1595189276,[removed],explainlikeimfive,ELI5: is five-G hurting people?
Cycloneraider26,1595188725,[removed],explainlikeimfive,"ELI5: How does amnesia work? Like how does someone remember language, but not their own name? (BTW, all my knowledge of amnesia comes from Jason Bourne)"
anottakenusername_1,1595188268,[removed],explainlikeimfive,"[ELI5] Why do people put pictures of their idols/role models/gods above their head and not, for example, at their feet?"
ect0_m9,1595188255,[removed],explainlikeimfive,"ELI5: I used to be able to shoot back multiple shots of tequila, liquor etc, but about a year later if i try to shoot back the same booze i used to i almost throw up, and this is every time, however I can drink my favourite cider and lager like its juice, why might this be?"
[deleted],1595187953,[deleted],explainlikeimfive,eli5 How do bone conduction headphones work?
curiousmeerkats,1595187792,"I understand dust being brought in, or forming from people or plants etc., but I have small, concealed and empty spaces in my house that form dust. How does this happen?",explainlikeimfive,ELI5: How does dust form in concealed spaces?
skinnylittlebird,1595187389,[removed],explainlikeimfive,eli5: What is the Higgs Boson and why is it important?
ect0_m9,1595187150,[removed],explainlikeimfive,Alcohol tolerance? eli5
NotYourTypicalAlpha,1595187102,[removed],explainlikeimfive,Eli5: Why is Windows or google forcing us to use Microsoft edge?
[deleted],1595185814,,explainlikeimfive,ELI5: how and why does a round lens from a camera return a square image?
[deleted],1595185802,[deleted],explainlikeimfive,ELI5: How does a soil moisture sensor work?
cuppaj0e,1595185646,[removed],explainlikeimfive,ELI5: How do lock companies prevent making duplicate locks?
[deleted],1595185624,,explainlikeimfive,"ELI5: Why do the bubbles on a dishwashing soap I put some water on, goes on an opposite direction when I flip the bottle?"
[deleted],1595185551,[deleted],explainlikeimfive,ELI5 Why does 68f at 45% humidity Feel hotter in the Summer then 68f at 45% humidity in the Winter?
[deleted],1595185455,,explainlikeimfive,ELI5: Why doesn't 0-gravity negatively impact the way food moves through the digestive system?
SChrisu,1595185289,[removed],explainlikeimfive,ELI5 Why every hard drive has partitions start from C but not from A ?
thad-deus,1595185222,[removed],explainlikeimfive,ELI5:How does money work?
toasterpRoN,1595184939,[removed],explainlikeimfive,"eli5: If, theoretically, Ghislaine Maxwell has these so-called ""Dead Man's Switch"", as some people believe...then how would they most likely be executed, why was Epstein unable to do so, and what would be the most effective system that she could set up?"
okmilo_18,1595184905,[removed],explainlikeimfive,ELI5: why are ice cream trucks cash only?
smasher162,1595184884,[removed],explainlikeimfive,eli5 why do producers have so much power in movie making.
tunacanoil,1595184779,,explainlikeimfive,Eli5: What is a qtable in machine learning? What is its significance in that context?
varunotelli,1595184692,"If there's a strong acid in our stomach accompanied with tonnes of enzymes, how is it that sometimes our stomach doesn't digest food?",explainlikeimfive,ELI5: How is indigestion caused?
JustForKnitsNGiggles,1595184679,[removed],explainlikeimfive,ELI5: What are the key differences between Democrats and Republicans?
Redpandaaaaaaaa,1595184385,,explainlikeimfive,ELI5 Why do video game companies make exclusive games for some consoles? Wouldn’t they make more money if it were open to all consoles?
[deleted],1595184222,[deleted],explainlikeimfive,ELI5: How come they can’t just make cigarettes ‘safer’ and remove all of the nasty chemicals that kill people? (Yes I know all forms of smoking are inherently unsafe)
ReadyToRambleVX,1595184112,[removed],explainlikeimfive,[ELI5] Why do cartoons from 20 years ago look and sound better than the ones in the present?
shouko_hikari,1595183947,"This is something I remember quite well from old ads you got on TV channel, the ones that were advertising weird kitchen gadgets. Every time they showed a shot of something bothersome, they made it more yellow. Why? And why yellow? Is it just my memory being faulty? There was definitely some effect added on top of those shots",explainlikeimfive,ELI5: Why do old ads tend to make undesirable things look more yellow?
[deleted],1595183896,[deleted],explainlikeimfive,"ELI5: What is HF, PE, IB etc in finance?"
the_actual_stegosaur,1595183889,[removed],explainlikeimfive,ELI5 Why does heat make you want to drink alcohol?
lightningcrane31,1595183851,I have to wear gloves now as a restaurant manager but my iPhone can still read my thumb print even though I’m wearing gloves? Like my thumbprint doesn’t show through the gloves.,explainlikeimfive,ELI5: How do thumbprint readers work through rubber gloves?
maxxumbreon,1595183657,[removed],explainlikeimfive,Eli5 How does a black hole form?
ashylarrysknees,1595183287,[removed],explainlikeimfive,How do monocles work?
AgentArticuno,1595183205,[removed],explainlikeimfive,"ELI5: ""Protestant Work Ethic"""
dogdaysdone,1595183114,[removed],explainlikeimfive,"ELI5: If antibodies for COVID-19 don't last long, what does this mean for a vaccine?"
Cagnoledge,1595182772,"Sequential gearboxes

Why is up (forward) down, and back (down) up? I think that makes sense? Reading it back it sounds weird asf.",explainlikeimfive,Eli5 sequential gearbox
